{
  "acceptance_criteria": {
    "equilibrated": true,
    "replica_uncertainty_reported": true
  },
  "assumptions": [
    "force field is qualified for polymer and filler surfaces",
    "finite cell represents the target composition"
  ],
  "boundary_conditions": {
    "loading": "equilibration or deformation protocol specified",
    "periodicity": "declared in all directions"
  },
  "compute_resources": {
    "cpu_or_gpu": "selected after LAMMPS probe",
    "replicas": "at least enough for uncertainty estimate"
  },
  "conditions": {
    "composition": "project-specific",
    "temperature_and_pressure": "processing-relevant and declared"
  },
  "convergence_plan": {
    "cell_and_chain_count": "size study",
    "sampling": "independent-replica convergence",
    "time_step": "stability study"
  },
  "expected_artifacts": [
    "LAMMPS data and inputs",
    "trajectories",
    "morphology and uncertainty report"
  ],
  "human_approval_nodes": [
    "interaction-model approval",
    "morphology acceptance"
  ],
  "initial_conditions": {
    "packing": "multiple independent packings with overlap checks"
  },
  "methods": [
    "LAMMPS molecular dynamics",
    "interface-energy analysis",
    "morphology statistics"
  ],
  "model_object": {
    "description": "Polymer-carbon-black LAMMPS interface workflow"
  },
  "parameter_sources": [
    {
      "parameter": "polymer-filler interactions",
      "source": "experiment, DFT handoff, or validated literature"
    }
  ],
  "question": "How do dispersion, selective localization, and interface interactions control the morphology of the polymer-carbon-black system?",
  "scales": [
    "atomistic",
    "mesoscale"
  ],
  "schema_version": "1.0",
  "system": {
    "filler": "carbon-black aggregate model",
    "polymer": "user-specified chemistry and molecular-weight profile"
  },
  "target_observables": [
    "dispersion_metric",
    "interfacial_adhesion",
    "cluster_statistics",
    "percolation_descriptors"
  ],
  "uncertainty_sources": [
    "force field",
    "aggregate morphology",
    "packing seed",
    "finite size"
  ],
  "validation_plan": {
    "checks": [
      "density",
      "energy stability",
      "radial distributions",
      "experimental morphology where available"
    ]
  },
  "workflow": "polymer-composite"
}
