{
  "acceptance_criteria": {
    "mesh_time_coupling_converged": true,
    "physical_validation": true
  },
  "assumptions": [
    "material models are qualified over the operating range",
    "coupling strategy is convergence-tested"
  ],
  "boundary_conditions": {
    "electrical_thermal_mechanical": "all surfaces, contacts, symmetry, and far-field conditions declared"
  },
  "compute_resources": {
    "memory": "estimated from mesh",
    "solver": "selected by nonlinearity and coupling"
  },
  "conditions": {
    "voltage_current_ambient_load_cycle": "declared"
  },
  "convergence_plan": {
    "coupling": "iteration tolerance study",
    "mesh": "field and interface refinement study",
    "time_step": "transient study"
  },
  "expected_artifacts": [
    "geometry and mesh",
    "material and boundary data",
    "coupled validation report"
  ],
  "human_approval_nodes": [
    "material-model approval",
    "high-field and safety review"
  ],
  "initial_conditions": {
    "temperature_and_mechanical_state": "declared with preload history"
  },
  "methods": [
    "finite element",
    "electro-thermal coupling",
    "thermo-mechanical coupling"
  ],
  "model_object": {
    "description": "Cable thermo-electro-mechanical finite-element workflow"
  },
  "parameter_sources": [
    {
      "parameter": "conductivity, permittivity, thermal and mechanical properties",
      "source": "experiment or traceable literature"
    }
  ],
  "question": "How do coupled temperature, electric field, stress, and deformation evolve across the cable insulation and interfaces under the target duty cycle?",
  "scales": [
    "continuum",
    "cable component"
  ],
  "schema_version": "1.0",
  "system": {
    "geometry": "conductor, screens, insulation, sheath, and interfaces",
    "materials": "temperature-dependent properties"
  },
  "target_observables": [
    "temperature",
    "electric_field",
    "stress",
    "strain",
    "interface_response"
  ],
  "uncertainty_sources": [
    "material properties",
    "contact conditions",
    "geometry tolerance",
    "load history"
  ],
  "validation_plan": {
    "checks": [
      "charge/energy balance",
      "analytical benchmark",
      "temperature measurements",
      "mechanical plausibility"
    ]
  },
  "workflow": "multiphysics"
}
